{
  "name": "Wisconsin",
  "filing": {
    "name": "Wisconsin Department of Financial Institutions",
    "url": "https://dfi.wi.gov"
  },
  "revenue": {
    "name": "Wisconsin Department of Revenue",
    "url": "https://www.revenue.wi.gov"
  },
  "labor": {
    "name": "Wisconsin Department of Workforce Development (UI)",
    "url": "https://dwd.wisconsin.gov/uitax"
  },
  "llcReport": {
    "frequency": "annual",
    "deadline": "Last day of the calendar quarter containing the anniversary month",
    "fee": "$25 (online)",
    "feeDetail": {
      "basis": "flat",
      "amount": 25,
      "online": 25
    }
  },
  "corpReport": {
    "frequency": "annual",
    "deadline": "Last day of the calendar quarter containing the anniversary month",
    "fee": "$25 (online)",
    "feeDetail": {
      "basis": "flat",
      "amount": 25,
      "online": 25
    }
  },
  "llcPublication": null,
  "entityTax": "Corporate income/franchise tax; pass-through entity tax (optional election)",
  "salesTax": {
    "statewide": true,
    "permit": "Wisconsin seller's permit",
    "agency": null,
    "alternative": null
  },
  "localSalesTax": "state_administered",
  "economicNexusUsd": 100000,
  "unemployment": {
    "wageBase": 14000,
    "minRate": 0,
    "maxRate": 10.7,
    "newEmployerRate": 2.5
  },
  "workersComp": {
    "agency": "Wisconsin DWD Worker's Compensation Division",
    "threshold": "3 employees, or $500 of payroll in a calendar quarter",
    "stateFund": false,
    "trigger": {
      "minEmployees": 3,
      "orAnnualPayroll": 2000
    }
  },
  "paidLeave": null,
  "paidSickLeave": null,
  "businessLicense": null,
  "local": {
    "title": "Local permits",
    "authority": "City, village or county",
    "description": "Wisconsin has no general business license; local permits and zoning approvals apply."
  },
  "dbaFiling": "county",
  "dbaOffice": "County register of deeds",
  "industry": {
    "contractor": "Wisconsin Department of Safety and Professional Services (dwelling contractor qualifier)",
    "realEstate": "Wisconsin Department of Safety and Professional Services",
    "alcohol": "Wisconsin Department of Revenue (with municipal licensing)",
    "childCare": "Wisconsin Department of Children and Families",
    "health": "Wisconsin Department of Health Services"
  },
  "cannabis": {
    "status": "cbd_only",
    "regulator": null
  },
  "links": {
    "formation": "https://dfi.wi.gov/Pages/BusinessServices/BusinessEntities/FileOnline.aspx",
    "annualReport": "https://dfi.wi.gov/Documents/BusinessServices/BusinessEntities/Forms/CORP5i.pdf",
    "uiRegistration": "https://dwd.wisconsin.gov/uitax/",
    "withholding": "https://www.revenue.wi.gov/Pages/Withholding/home.aspx",
    "salesTax": "https://www.revenue.wi.gov/Pages/FAQS/pcs-seller.aspx",
    "entityTax": "https://www.revenue.wi.gov/Pages/FAQS/ise-crpginfo.aspx",
    "laborPosters": "https://dwd.wisconsin.gov/dwd/workplace-posters/",
    "dba": "https://dfi.wi.gov/Pages/BusinessServices/Trademarks/GeneralInformation.aspx"
  },
  "verification": {
    "checkedOn": "2026-10-13",
    "sources": ["https://dfi.wi.gov/Pages/BusinessServices/BusinessEntities/Fees.aspx"],
    "unconfirmed": []
  }
}
