{
  "name": "Indiana",
  "filing": {
    "name": "Indiana Secretary of State (INBiz)",
    "url": ["https://inbiz.in.gov"]
  },
  "revenue": {
    "name": "Indiana Department of Revenue",
    "url": ["https://www.in.gov/dor"]
  },
  "labor": {
    "name": "Indiana Department of Workforce Development",
    "url": ["https://www.in.gov/dwd"]
  },
  "llcReport": {
    "title": "File Business Entity Report",
    "rrule": "FREQ=YEARLY;INTERVAL=2;BYMONTHDAY=-1",
    "feeDetail": {
      "basis": "flat",
      "amount": 31,
      "online": 31
    }
  },
  "corpReport": {
    "title": "File Business Entity Report",
    "rrule": "FREQ=YEARLY;INTERVAL=2;BYMONTHDAY=-1",
    "feeDetail": {
      "basis": "flat",
      "amount": 31,
      "online": 31
    }
  },
  "lpReport": {
    "title": "File Business Entity Report",
    "rrule": "FREQ=YEARLY;INTERVAL=2;BYMONTHDAY=-1",
    "feeDetail": {
      "basis": "flat",
      "amount": 50
    }
  },
  "llpReport": {
    "title": "File Business Entity Report",
    "rrule": "FREQ=YEARLY;INTERVAL=2;BYMONTHDAY=-1",
    "feeDetail": {
      "basis": "flat",
      "amount": 50
    }
  },
  "llcPublication": null,
  "entityTax": "Corporate adjusted gross income tax",
  "salesTax": {
    "statewide": true,
    "permit": "Registered Retail Merchant Certificate",
    "agency": null,
    "alternative": null
  },
  "localSalesTax": "none",
  "economicNexusUsd": 100000,
  "unemployment": {
    "wageBase": 9500,
    "minRate": 0.5,
    "maxRate": 7.4,
    "newEmployerRate": 2.5
  },
  "workersComp": {
    "agency": "Indiana Worker's Compensation Board",
    "stateFund": false,
    "trigger": {
      "minEmployees": 1
    }
  },
  "paidLeave": null,
  "paidSickLeave": null,
  "businessLicense": null,
  "local": {
    "title": "Local permits",
    "authority": "City or county",
    "description": "Indiana has no general local business license; local zoning/occupancy and industry permits apply."
  },
  "dbaFiling": "county",
  "dbaOffice": "County recorder",
  "industry": {
    "contractor": null,
    "realEstate": "Indiana Professional Licensing Agency",
    "alcohol": "Indiana Alcohol and Tobacco Commission",
    "childCare": "Indiana FSSA Bureau of Child Care",
    "health": "Indiana Department of Health"
  },
  "cannabis": {
    "status": "cbd_only",
    "regulator": null
  },
  "links": {
    "formation": ["https://www.in.gov/sos/business/"],
    "annualReport": ["https://inbiz.in.gov/business-filings/business-entityreport"],
    "uiRegistration": ["https://www.in.gov/dwd/indiana-unemployment/employers/ess"],
    "withholding": ["https://www.in.gov/dor/i-am-a/business-corp/withholding/"],
    "salesTax": ["https://www.in.gov/dor/i-am-a/business-corp/sales-tax/"],
    "entityTax": ["https://inbiz.in.gov/taxes-fees/tax-registration"],
    "laborPosters": ["https://www.in.gov/dwd/indiana-unemployment/employers/forms-downloads/required-employer-posters"],
    "dba": ["https://faqs.in.gov/hc/en-us/articles/115005053207-How-do-I-file-an-Assumed-Business-Name-DBA"]
  },
  "verification": {
    "checkedOn": "2026-10-13",
    "sources": ["https://www.in.gov/sos/business/business-entity-reports"],
    "unconfirmed": []
  }
}
