{
  "name": "Texas",
  "filing": {
    "name": "Texas Secretary of State",
    "url": "https://www.sos.state.tx.us/corp/index.shtml"
  },
  "revenue": {
    "name": "Texas Comptroller of Public Accounts",
    "url": "https://comptroller.texas.gov"
  },
  "labor": {
    "name": "Texas Workforce Commission",
    "url": "https://www.twc.texas.gov"
  },
  "llcReport": {
    "title": "File Franchise Tax Report and Public Information Report",
    "rrule": "FREQ=YEARLY;BYMONTH=5;BYMONTHDAY=15",
    "feeDetail": {
      "basis": "none",
      "amount": 0,
      "note": "no tax due at or below $2.65 million of annualized revenue (2026 report)"
    }
  },
  "corpReport": {
    "title": "File Franchise Tax Report and Public Information Report",
    "rrule": "FREQ=YEARLY;BYMONTH=5;BYMONTHDAY=15",
    "feeDetail": {
      "basis": "none",
      "amount": 0,
      "note": "no tax due at or below $2.65 million of annualized revenue (2026 report)"
    }
  },
  "llcPublication": null,
  "entityTax": "Franchise (margin) tax",
  "entityTaxDetail": {
    "kind": "margin",
    "thresholdUsd": 2650000,
    "rate": 0.75,
    "summary": "0.75% of taxable margin (0.375% for retail and wholesale); no tax due at or below $2.65 million of annualized total revenue, though the report is still filed",
    "source": "https://comptroller.texas.gov/taxes/franchise/",
    "checkedOn": "2026-10-13"
  },
  "salesTax": {
    "statewide": true,
    "permit": "Texas Sales and Use Tax Permit",
    "agency": null,
    "alternative": null
  },
  "localSalesTax": "state_administered",
  "economicNexusUsd": 500000,
  "unemployment": {
    "wageBase": 9000,
    "minRate": 0.32,
    "maxRate": 6.32,
    "newEmployerRate": 2.7
  },
  "workersComp": {
    "agency": "Texas Department of Insurance, Division of Workers' Compensation",
    "threshold": "Optional for most private employers (mandatory for public contractors)",
    "stateFund": false,
    "trigger": {
      "minEmployees": 1,
      "elective": true
    }
  },
  "paidLeave": null,
  "paidSickLeave": null,
  "businessLicense": null,
  "local": {
    "title": "Local permits",
    "authority": "City or county",
    "description": "Texas has no general state or city business license; occupancy, health, signage and industry permits are local, and DBAs go to the county clerk."
  },
  "dbaFiling": "county",
  "dbaOffice": "County clerk",
  "industry": {
    "contractor": null,
    "realEstate": "Texas Real Estate Commission",
    "alcohol": "Texas Alcoholic Beverage Commission",
    "childCare": "Texas HHSC, Child Care Regulation",
    "health": "Texas Health and Human Services Commission"
  },
  "cannabis": {
    "status": "medical_only",
    "regulator": "Texas Department of Public Safety, Compassionate Use Program",
    "note": "Texas's compassionate-use program is limited in scope."
  },
  "links": {
    "formation": "https://www.sos.state.tx.us/corp/forms_boc.shtml",
    "annualReport": "https://comptroller.texas.gov/taxes/franchise/",
    "uiRegistration": "https://www.twc.texas.gov/services/register-tax",
    "salesTax": "https://comptroller.texas.gov/taxes/sales/",
    "entityTax": "https://comptroller.texas.gov/taxes/franchise/",
    "laborPosters": "https://www.twc.texas.gov/programs/unemployment-tax/posters-workplace",
    "dba": "https://www.sos.state.tx.us/corp/namefilingsfaqs.shtml"
  },
  "verification": {
    "checkedOn": "2026-10-13",
    "sources": ["https://comptroller.texas.gov/taxes/franchise/"],
    "unconfirmed": []
  }
}
