{
  "name": "South Carolina",
  "filing": {
    "name": "South Carolina Secretary of State",
    "url": "https://sos.sc.gov/online-filings"
  },
  "revenue": {
    "name": "South Carolina Department of Revenue",
    "url": "https://dor.sc.gov"
  },
  "labor": {
    "name": "South Carolina Department of Employment and Workforce",
    "url": "https://dew.sc.gov"
  },
  "llcReport": null,
  "corpReport": {
    "title": "File Annual Report and Corporate License Fee (with SCDOR)",
    "frequency": "annual",
    "deadline": "With the corporate income tax return (April 15)",
    "feeDetail": {
      "basis": "percent",
      "rate": 0.1,
      "min": 25,
      "note": "of capital stock and paid-in surplus, plus $15"
    }
  },
  "llpReport": {
    "title": "Renew LLP certificate",
    "rrule": "FREQ=YEARLY",
    "deadline": "Anniversary of registration",
    "feeDetail": {
      "basis": "flat",
      "amount": 100
    }
  },
  "llcReportAppliesWhenTaxedAsCorp": true,
  "llcPublication": null,
  "entityTax": "Corporate income tax and corporate license fee",
  "salesTax": {
    "statewide": true,
    "permit": "South Carolina retail license",
    "agency": null,
    "alternative": null
  },
  "localSalesTax": "state_administered",
  "economicNexusUsd": 100000,
  "unemployment": {
    "wageBase": 14000,
    "minRate": 0,
    "maxRate": 5.4,
    "newEmployerRate": 1
  },
  "workersComp": {
    "agency": "South Carolina Workers' Compensation Commission",
    "threshold": "4 employees (annual payroll of $3,000 or more)",
    "stateFund": false,
    "trigger": {
      "minEmployees": 4,
      "andAnnualPayrollAtLeast": 3000
    }
  },
  "paidLeave": null,
  "paidSickLeave": null,
  "businessLicense": null,
  "local": {
    "title": "Municipal or county business license",
    "authority": "City or county business license office",
    "description": "Every South Carolina business needs a local business license under the Business License Tax Standardization Act."
  },
  "dbaFiling": "none",
  "industry": {
    "contractor": "South Carolina Contractors' Licensing Board",
    "realEstate": "South Carolina Real Estate Commission",
    "alcohol": "South Carolina Department of Revenue, Alcohol Beverage Licensing",
    "childCare": "South Carolina Department of Social Services",
    "health": "South Carolina Department of Public Health"
  },
  "cannabis": {
    "status": "cbd_only",
    "regulator": null
  },
  "links": {
    "formation": "https://sos.sc.gov/online-filings/business-entities",
    "annualReport": "https://dor.sc.gov/business-income-taxes/corporate",
    "uiRegistration": "https://dew.sc.gov/employers",
    "withholding": "https://dor.sc.gov/withholding",
    "salesTax": "https://dor.sc.gov/sales-use-tax-index",
    "entityTax": "https://dor.sc.gov/business-income-taxes/corporate/c-corporation",
    "laborPosters": "https://llr.sc.gov/wage/posters.aspx"
  },
  "verification": {
    "checkedOn": "2026-10-13",
    "sources": ["https://dor.sc.gov/business-income-taxes/corporate/corporate-faqs"],
    "unconfirmed": []
  }
}
