{
  "name": "District of Columbia",
  "filing": {
    "name": "DC Department of Licensing and Consumer Protection",
    "url": ["https://dlcp.dc.gov"]
  },
  "revenue": {
    "name": "DC Office of Tax and Revenue",
    "url": ["https://otr.cfo.dc.gov"]
  },
  "labor": {
    "name": "DC Department of Employment Services",
    "url": ["https://does.dc.gov"]
  },
  "llcReport": {
    "title": "File Biennial Report",
    "rrule": "FREQ=YEARLY;INTERVAL=2;BYMONTH=4;BYMONTHDAY=1",
    "anchor": "year_after_formation",
    "feeDetail": {
      "basis": "flat",
      "amount": 300
    }
  },
  "corpReport": {
    "title": "File Biennial Report",
    "rrule": "FREQ=YEARLY;INTERVAL=2;BYMONTH=4;BYMONTHDAY=1",
    "anchor": "year_after_formation",
    "feeDetail": {
      "basis": "flat",
      "amount": 300
    }
  },
  "llcPublication": null,
  "entityTax": "Franchise tax (corporations) and Unincorporated Business Franchise Tax",
  "salesTax": {
    "statewide": true,
    "permit": "Sales and use tax registration (FR-500)",
    "agency": null,
    "alternative": null
  },
  "localSalesTax": "none",
  "economicNexusUsd": 100000,
  "unemployment": {
    "wageBase": 9000,
    "minRate": 1.9,
    "maxRate": 7.4,
    "newEmployerRate": 2.7
  },
  "workersComp": {
    "agency": "DC DOES Office of Workers' Compensation",
    "stateFund": false,
    "trigger": {
      "minEmployees": 1
    }
  },
  "paidLeave": {
    "title": "DC Paid Family Leave tax",
    "agency": "DC Office of Paid Family Leave",
    "description": "Employers pay a quarterly payroll tax to the Universal Paid Leave Fund.",
    "minEmployees": 1
  },
  "paidSickLeave": {
    "minEmployees": 1
  },
  "businessLicense": {
    "title": "DC Basic Business License (BBL)",
    "authority": "DC Department of Licensing and Consumer Protection",
    "url": ["https://dlcp.dc.gov/node/1618236"],
    "rrule": "FREQ=YEARLY;INTERVAL=2",
    "feeDetail": {
      "basis": "varies",
      "note": "by license category"
    }
  },
  "local": {
    "title": "DC Certificate of Occupancy / Home Occupation permit",
    "authority": "DC Department of Buildings / DLCP",
    "description": "The District is both city and state; occupancy and zoning approvals are issued locally."
  },
  "dbaFiling": "state",
  "industry": {
    "contractor": "DC Department of Licensing and Consumer Protection",
    "realEstate": "DC Real Estate Commission",
    "alcohol": "DC Alcoholic Beverage and Cannabis Administration",
    "childCare": "DC Office of the State Superintendent of Education",
    "health": "DC Health"
  },
  "cannabis": {
    "status": "medical_only",
    "regulator": "DC Alcoholic Beverage and Cannabis Administration",
    "note": "Adult possession is legal but commercial adult-use sales are not licensed; the medical program is licensed."
  },
  "links": {
    "formation": ["https://dlcp.dc.gov/page/corporations-division-business-registration-faqs"],
    "annualReport": ["https://dlcp.dc.gov/page/corporations-division-business-registration-faqs"],
    "uiRegistration": ["https://does.dc.gov/page/ui-tax-employers"],
    "withholding": [
      "https://otr.cfo.dc.gov/sites/default/files/dc/sites/otr/publication/attachments/FR-500_314.pdf"
    ],
    "salesTax": [
      "https://otr.cfo.dc.gov/sites/default/files/dc/sites/otr/publication/attachments/FR-500_314.pdf"
    ],
    "entityTax": [
      "https://otr.cfo.dc.gov/sites/default/files/dc/sites/otr/publication/attachments/2025_D-20_Book_Final_wLinks_02272026.pdf"
    ],
    "laborPosters": ["https://does.dc.gov/page/office-wage-hour-employers"],
    "dba": ["https://dlcp.dc.gov/node/1619191"]
  },
  "verification": {
    "checkedOn": "2026-10-13",
    "sources": ["https://dlcp.dc.gov/page/corporations-division-fees-limited-liability-company"],
    "unconfirmed": []
  }
}
