{
  "name": "New Mexico",
  "filing": {
    "name": "New Mexico Secretary of State",
    "url": "https://www.sos.nm.gov/business-services"
  },
  "revenue": {
    "name": "New Mexico Taxation and Revenue Department",
    "url": "https://www.tax.newmexico.gov"
  },
  "labor": {
    "name": "New Mexico Department of Workforce Solutions",
    "url": "https://www.dws.state.nm.us"
  },
  "llcReport": null,
  "corpReport": {
    "title": "File Biennial Report",
    "rrule": "FREQ=YEARLY;INTERVAL=2;BYMONTH=4;BYMONTHDAY=15",
    "deadline": "April 15, every 2 years (aligned with the federal corporate return)",
    "feeDetail": {
      "basis": "flat",
      "amount": 25
    }
  },
  "llpReport": {
    "rrule": "FREQ=YEARLY;BYMONTH=4;BYMONTHDAY=1",
    "opens": {
      "month": 1,
      "day": 1
    },
    "feeDetail": {
      "basis": "varies",
      "note": "per Secretary of State fee schedule"
    }
  },
  "llcPublication": null,
  "entityTax": "Corporate income tax and gross receipts tax",
  "salesTax": {
    "statewide": true,
    "permit": "New Mexico CRS (Combined Reporting System) registration",
    "agency": {
      "name": "New Mexico Taxation and Revenue Department",
      "url": "https://www.tax.newmexico.gov"
    },
    "alternative": null
  },
  "localSalesTax": "state_administered",
  "economicNexusUsd": 100000,
  "unemployment": {
    "wageBase": 34800,
    "minRate": 0.33,
    "maxRate": 5.4,
    "newEmployerRate": null
  },
  "workersComp": {
    "agency": "New Mexico Workers' Compensation Administration",
    "stateFund": false,
    "trigger": {
      "minEmployees": 3
    }
  },
  "paidLeave": null,
  "paidSickLeave": {
    "minEmployees": 1
  },
  "businessLicense": null,
  "local": {
    "title": "City/county business registration",
    "authority": "City or county",
    "description": "Albuquerque, Santa Fe and others require local business registration."
  },
  "dbaFiling": "none",
  "industry": {
    "contractor": "New Mexico Construction Industries Division",
    "realEstate": "New Mexico Real Estate Commission",
    "alcohol": "New Mexico Alcohol and Gaming Division",
    "childCare": "New Mexico Early Childhood Education and Care Department",
    "health": "New Mexico Department of Health"
  },
  "cannabis": {
    "status": "adult_use",
    "regulator": "New Mexico Cannabis Control Division (Regulation and Licensing Department)"
  },
  "links": {
    "formation": "https://www.sos.nm.gov/business-services/",
    "annualReport": "https://www.sos.nm.gov/business-services/",
    "uiRegistration": "https://www.dws.nm.gov/UI-Tax-Information",
    "withholding": "https://www.tax.newmexico.gov/businesses/withholding-tax-and-workers-compensation/",
    "salesTax": "https://www.tax.newmexico.gov/businesses/gross-receipts-overview/",
    "entityTax": "https://www.tax.newmexico.gov/businesses/",
    "laborPosters": "https://www.dws.nm.gov/en-us/State-and-Federal-Posters"
  },
  "verification": {
    "checkedOn": "2026-10-13",
    "sources": ["https://www.sos.nm.gov/business-services/"],
    "unconfirmed": []
  }
}
